<?xml version="1.0" encoding="UTF-8"?>
<Index_C5 xmlns:xsi="http://www.w3.org/2001/XMLSchema-instance" xsi:noNamespaceSchemaLocation="GRD_R04.xsd">
  <Entete>
    <Identifiant_Flux>Identifiant_Flux</Identifiant_Flux>
    <Libelle_Flux>Libelle_Flux</Libelle_Flux>
    <Identifiant_Emetteur>Identifiant_Emetteur</Identifiant_Emetteur>
    <Coordonnees_Emetteur>
      <Coordonnees_E_Ligne1>Coordonnees_E_Ligne1</Coordonnees_E_Ligne1>
    </Coordonnees_Emetteur>
    <Identifiant_Destinataire>Identifiant_Destinataire</Identifiant_Destinataire>
    <Coordonnees_Destinataire>
      <Coordonnees_D_Ligne1>Coordonnees_D_Ligne1</Coordonnees_D_Ligne1>
    </Coordonnees_Destinataire>
    <Date_Version_Message>2001-01-01</Date_Version_Message>
    <Date_Creation>2001-12-31T12:00:00</Date_Creation>
  </Entete>
  <Corps_de_fichier_par_PDL>
    <Identifiant_Stable_PDL>Identifiant_Stable_PDL</Identifiant_Stable_PDL>
    <Rang_QE>Rang_QE</Rang_QE>
    <Type_Client>Type_Client</Type_Client>
    <Type_Relation_Contractuelle>Type_Relation_Contractuelle</Type_Relation_Contractuelle>
    <Evenement_Declencheur>Evenement_Declencheur</Evenement_Declencheur>
    <Numero_Telephone_Depannage_Urgence>Numero_Telephone_Depannage_Urgence</Numero_Telephone_Depannage_Urgence>
    <Facture_Deroutee>Facture_Deroutee</Facture_Deroutee>
    <Source_Redressement>Source_Redressement</Source_Redressement>
    <Motif_Redressement>Motif_Redressement</Motif_Redressement>
    <Commentaire_Redressement>Commentaire_Redressement</Commentaire_Redressement>
    <Date_Theorique_Prochaine_Releve>2001-01-01</Date_Theorique_Prochaine_Releve>
    <Situation_Contrat>
      <Identifiant_Responsable_Equilibre>Identifiant_Responsable_Equilibre</Identifiant_Responsable_Equilibre>
      <Code_Tarif>Code_Tarif</Code_Tarif>
      <Identifiant_Situation>Identifiant_Situation</Identifiant_Situation>
      <Mode_Redressement>Mode_Redressement</Mode_Redressement>
      <Compteur>
        <Matricule_Compteur>Matricule_Compteur</Matricule_Compteur>
        <Nombre_Cadrans>1</Nombre_Cadrans>
        <Periode>
          <Indicateur_De_Periode>Indicateur_De_Periode</Indicateur_De_Periode>
          <Puissance_Souscrite>1</Puissance_Souscrite>
          <Donnees_Cadran>
            <Rang_Cadran>Rang_Cadran</Rang_Cadran>
          </Donnees_Cadran>
        </Periode>
      </Compteur>
    </Situation_Contrat>
  </Corps_de_fichier_par_PDL>
</Index_C5>
